{
  "version": 1,
  "meta": {
    "title": "Fixture",
    "format": "landscape",
    "seed": 3,
    "mode": "choreographed",
    "theme": "white_stage"
  },
  "characters": [
    {
      "id": "hero",
      "x": 900,
      "facing": 1,
      "color": "#f4f4f0",
      "scale": 1.0,
      "hp": 100
    },
    {
      "id": "foe",
      "x": 1010,
      "facing": -1,
      "color": "#ff3b3b",
      "scale": 1.0,
      "hp": 100
    }
  ],
  "camera": [
    {
      "at": 0,
      "mode": "follow",
      "targets": [
        "hero",
        "foe"
      ],
      "zoom": "auto"
    }
  ],
  "beats": [
    {
      "id": "t1",
      "at": 0.3,
      "who": "foe",
      "do": "taunt",
      "say": "Try me!"
    },
    {
      "id": "j1",
      "at": {
        "after": "t1"
      },
      "who": "hero",
      "do": "jab",
      "target": "foe",
      "approach": "walk",
      "outcome": "hit"
    },
    {
      "id": "c1",
      "at": {
        "after": "j1"
      },
      "who": "hero",
      "do": "cross",
      "target": "foe",
      "outcome": "hit"
    },
    {
      "id": "ko",
      "at": {
        "after": "c1",
        "delay": 0.2
      },
      "who": "foe",
      "do": "ko_fall"
    },
    {
      "id": "v1",
      "at": {
        "after": "ko"
      },
      "who": "hero",
      "do": "victory"
    },
    {
      "at": {
        "after": "v1",
        "delay": 0.3
      },
      "who": "world",
      "do": "fade",
      "params": {
        "to": "black",
        "dur": 0.8
      }
    }
  ]
}